{
  "version": "2.0.0",
  "update": "202505031702",
  "game_version": "Gold_Silver_Crystal",
  "waza": {
    "johto": [
      {
        "no": "1",
        "globalNo": "152",
        "form": [
          {
            "form": "",
            "region": "",
            "mega_evolution": "",
            "gigantamax": "",
            "": [
              "たいあたり",
              "なきごえ"
            ],
            "思い出し": [
            ],
            "進化時": [
            ],
            "8": [
              "はっぱカッター"
            ],
            "12": [
              "リフレクター"
            ],
            "15": [
              "どくのこな"
            ],
            "22": [
              "こうごうせい"
            ],
            "29": [
              "のしかかり"
            ],
            "36": [
              "ひかりのかべ"
            ],
            "43": [
              "しんぴのまもり"
            ],
            "50": [
              "ソーラービーム"
            ],
            "わざマシン": [
            ]
          }
        ]
      },
      {
        "no": "2",
        "globalNo": "153",
        "form": [
          {
            "form": "",
            "region": "",
            "mega_evolution": "",
            "gigantamax": "",
            "": [
              "たいあたり",
              "なきごえ"
            ],
            "思い出し": [
            ],
            "進化時": [
            ],
            "8": [
              "はっぱカッター"
            ],
            "12": [
              "リフレクター"
            ],
            "15": [
              "どくのこな"
            ],
            "23": [
              "こうごうせい"
            ],
            "31": [
              "のしかかり"
            ],
            "39": [
              "ひかりのかべ"
            ],
            "47": [
              "しんぴのまもり"
            ],
            "55": [
              "ソーラービーム"
            ],
            "わざマシン": [
            ]
          }
        ]
      },
      {
        "no": "3",
        "globalNo": "154",
        "form": [
          {
            "form": "",
            "region": "",
            "mega_evolution": "",
            "gigantamax": "",
            "": [
              "たいあたり",
              "なきごえ"
            ],
            "思い出し": [
            ],
            "進化時": [
            ],
            "8": [
              "はっぱカッター"
            ],
            "12": [
              "リフレクター"
            ],
            "15": [
              "どくのこな"
            ],
            "23": [
              "こうごうせい"
            ],
            "31": [
              "のしかかり"
            ],
            "41": [
              "ひかりのかべ"
            ],
            "51": [
              "しんぴのまもり"
            ],
            "61": [
              "ソーラービーム"
            ],
            "わざマシン": [
            ]
          }
        ]
      },
      {
        "no": "4",
        "globalNo": "155",
        "form": [
          {
            "form": "",
            "region": "",
            "mega_evolution": "",
            "gigantamax": "",
            "": [
              "たいあたり",
              "にらみつける"
            ],
            "思い出し": [
            ],
            "進化時": [
            ],
            "6": [
              "えんまく"
            ],
            "12": [
              "ひのこ"
            ],
            "19": [
              "でんこうせっか"
            ],
            "27": [
              "かえんぐるま"
            ],
            "36": [
              "スピードスター"
            ],
            "46": [
              "かえんほうしゃ"
            ],
            "わざマシン": [
            ]
          }
        ]
      },
      {
        "no": "5",
        "globalNo": "156",
        "form": [
          {
            "form": "",
            "region": "",
            "mega_evolution": "",
            "gigantamax": "",
            "": [
              "たいあたり",
              "にらみつける"
            ],
            "思い出し": [
            ],
            "進化時": [
            ],
            "6": [
              "えんまく"
            ],
            "12": [
              "ひのこ"
            ],
            "21": [
              "でんこうせっか"
            ],
            "31": [
              "かえんぐるま"
            ],
            "42": [
              "スピードスター"
            ],
            "54": [
              "かえんほうしゃ"
            ],
            "わざマシン": [
            ]
          }
        ]
      },
      {
        "no": "6",
        "globalNo": "157",
        "form": [
          {
            "form": "",
            "region": "",
            "mega_evolution": "",
            "gigantamax": "",
            "": [
              "たいあたり",
              "にらみつける"
            ],
            "思い出し": [
            ],
            "進化時": [
            ],
            "6": [
              "えんまく"
            ],
            "12": [
              "ひのこ"
            ],
            "21": [
              "でんこうせっか"
            ],
            "31": [
              "かえんぐるま"
            ],
            "45": [
              "スピードスター"
            ],
            "60": [
              "かえんほうしゃ"
            ],
            "わざマシン": [
            ]
          }
        ]
      },
      {
        "no": "7",
        "globalNo": "158",
        "form": [
          {
            "form": "",
            "region": "",
            "mega_evolution": "",
            "gigantamax": "",
            "": [
              "ひっかく",
              "にらみつける"
            ],
            "思い出し": [
            ],
            "進化時": [
            ],
            "7": [
              "いかり"
            ],
            "13": [
              "みずでっぽう"
            ],
            "20": [
              "かみつく"
            ],
            "27": [
              "こわいかお"
            ],
            "35": [
              "きりさく"
            ],
            "43": [
              "いやなおと"
            ],
            "52": [
              "ハイドロポンプ"
            ],
            "わざマシン": [
            ]
          }
        ]
      },
      {
        "no": "8",
        "globalNo": "159",
        "form": [
          {
            "form": "",
            "region": "",
            "mega_evolution": "",
            "gigantamax": "",
            "": [
              "ひっかく",
              "にらみつける"
            ],
            "思い出し": [
            ],
            "進化時": [
            ],
            "7": [
              "いかり"
            ],
            "13": [
              "みずでっぽう"
            ],
            "21": [
              "かみつく"
            ],
            "28": [
              "こわいかお"
            ],
            "37": [
              "きりさく"
            ],
            "45": [
              "いやなおと"
            ],
            "55": [
              "ハイドロポンプ"
            ],
            "わざマシン": [
            ]
          }
        ]
      },
      {
        "no": "9",
        "globalNo": "160",
        "form": [
          {
            "form": "",
            "region": "",
            "mega_evolution": "",
            "gigantamax": "",
            "": [
              "ひっかく",
              "にらみつける"
            ],
            "思い出し": [
            ],
            "進化時": [
            ],
            "7": [
              "いかり"
            ],
            "13": [
              "みずでっぽう"
            ],
            "21": [
              "かみつく"
            ],
            "28": [
              "こわいかお"
            ],
            "38": [
              "きりさく"
            ],
            "47": [
              "いやなおと"
            ],
            "58": [
              "ハイドロポンプ"
            ],
            "わざマシン": [
            ]
          }
        ]
      },
      {
        "no": "10",
        "globalNo": "16",
        "form": [
          {
            "form": "",
            "region": "",
            "mega_evolution": "",
            "gigantamax": "",
            "": [
              "たいあたり"
            ],
            "思い出し": [
            ],
            "進化時": [
            ],
            "5": [
              "すなかけ"
            ],
            "9": [
              "かぜおこし"
            ],
            "15": [
              "でんこうせっか"
            ],
            "21": [
              "ふきとばし"
            ],
            "29": [
              "つばさでうつ"
            ],
            "37": [
              "こうそくいどう"
            ],
            "47": [
              "オウムがえし"
            ],
            "わざマシン": [
            ]
          }
        ]
      },
      {
        "no": "11",
        "globalNo": "17",
        "form": [
          {
            "form": "",
            "region": "",
            "mega_evolution": "",
            "gigantamax": "",
            "": [
              "たいあたり"
            ],
            "思い出し": [
            ],
            "進化時": [
            ],
            "5": [
              "すなかけ"
            ],
            "9": [
              "かぜおこし"
            ],
            "15": [
              "でんこうせっか"
            ],
            "23": [
              "ふきとばし"
            ],
            "33": [
              "つばさでうつ"
            ],
            "43": [
              "こうそくいどう"
            ],
            "55": [
              "オウムがえし"
            ],
            "わざマシン": [
            ]
          }
        ]
      },
      {
        "no": "12",
        "globalNo": "18",
        "form": [
          {
            "form": "",
            "region": "",
            "mega_evolution": "",
            "gigantamax": "",
            "": [
              "たいあたり"
            ],
            "思い出し": [
            ],
            "進化時": [
            ],
            "5": [
              "すなかけ"
            ],
            "9": [
              "かぜおこし"
            ],
            "15": [
              "でんこうせっか"
            ],
            "23": [
              "ふきとばし"
            ],
            "33": [
              "つばさでうつ"
            ],
            "46": [
              "こうそくいどう"
            ],
            "61": [
              "オウムがえし"
            ],
            "わざマシン": [
            ]
          }
        ]
      },
      {
        "no": "13",
        "globalNo": "21",
        "form": [
          {
            "form": "",